{
  "generated_disjointness": "vouch.generated-disjointness/v0",
  "version": "1.3.11",
  "generator": {
    "script": "scripts/check-generated-disjointness.mjs",
    "seed": "W1.2-generated-disjointness-0001",
    "mode": "deterministic-top-level-field-tag-combinations",
    "native_verifier_mode": "recorded-only-no-source-recompute",
    "base_artifacts": {
      "native_receipt": "examples/vouch-loop/expected/refund-window.json",
      "bridge_report": "examples/vouch-bridge/reports/checkout-discount.bridge.json"
    }
  },
  "properties": {
    "P1_no_dual_accept": true,
    "P2_valid_bridge_native_rejects": true,
    "P3_valid_native_bridge_rejects": true
  },
  "summary": {
    "generated_case_count": 32,
    "native_accept_count": 2,
    "bridge_accept_count": 2,
    "dual_accept_count": 0
  },
  "cases": [
    {
      "id": "P2-valid-bridge",
      "label": "valid Bridge report",
      "coverage": [
        "P2-valid-bridge-native-rejects"
      ],
      "native_accepts": false,
      "bridge_accepts": true,
      "native_exit_code": 1,
      "bridge_exit_code": 0,
      "native_failure_head": [
        "unknown-top-level-field:bridge_report",
        "unknown-top-level-field:profile",
        "unknown-top-level-field:subject",
        "unknown-top-level-field:checks",
        "unknown-top-level-field:linked_artifacts"
      ],
      "bridge_failure_head": []
    },
    {
      "id": "P3-valid-native",
      "label": "valid native receipt",
      "coverage": [
        "P3-valid-native-bridge-rejects"
      ],
      "native_accepts": true,
      "bridge_accepts": false,
      "native_exit_code": 0,
      "bridge_exit_code": 1,
      "native_failure_head": [],
      "bridge_failure_head": [
        "unknown-top-level-field:canonical",
        "unknown-top-level-field:comparison",
        "unknown-top-level-field:differential_receipt",
        "unknown-top-level-field:graph",
        "unknown-top-level-field:input"
      ]
    },
    {
      "id": "G-01-bridge-required-native",
      "label": "bridge-required fields with native tag mode",
      "coverage": [
        "P1-no-dual-accept"
      ],
      "native_accepts": false,
      "bridge_accepts": false,
      "native_exit_code": 1,
      "bridge_exit_code": 1,
      "native_failure_head": [
        "non-canonical-artifact-json"
      ],
      "bridge_failure_head": [
        "non-canonical-artifact-json"
      ]
    },
    {
      "id": "G-02-bridge-required-bridge",
      "label": "bridge-required fields with bridge tag mode",
      "coverage": [
        "P1-no-dual-accept"
      ],
      "native_accepts": false,
      "bridge_accepts": true,
      "native_exit_code": 1,
      "bridge_exit_code": 0,
      "native_failure_head": [
        "unknown-top-level-field:bridge_report",
        "unknown-top-level-field:profile",
        "unknown-top-level-field:subject",
        "unknown-top-level-field:checks",
        "unknown-top-level-field:linked_artifacts"
      ],
      "bridge_failure_head": []
    },
    {
      "id": "G-03-bridge-required-both",
      "label": "bridge-required fields with both tag mode",
      "coverage": [
        "P1-no-dual-accept"
      ],
      "native_accepts": false,
      "bridge_accepts": false,
      "native_exit_code": 1,
      "bridge_exit_code": 1,
      "native_failure_head": [
        "non-canonical-artifact-json"
      ],
      "bridge_failure_head": [
        "unknown-top-level-field:differential_receipt"
      ]
    },
    {
      "id": "G-04-bridge-required-wrong",
      "label": "bridge-required fields with wrong tag mode",
      "coverage": [
        "P1-no-dual-accept"
      ],
      "native_accepts": false,
      "bridge_accepts": false,
      "native_exit_code": 1,
      "bridge_exit_code": 1,
      "native_failure_head": [
        "non-canonical-artifact-json"
      ],
      "bridge_failure_head": [
        "unknown-top-level-field:differential_receipt",
        "tag-mismatch"
      ]
    },
    {
      "id": "G-05-bridge-required-none",
      "label": "bridge-required fields with none tag mode",
      "coverage": [
        "P1-no-dual-accept"
      ],
      "native_accepts": false,
      "bridge_accepts": false,
      "native_exit_code": 1,
      "bridge_exit_code": 1,
      "native_failure_head": [
        "non-canonical-artifact-json"
      ],
      "bridge_failure_head": [
        "missing-bridge_report",
        "tag-mismatch"
      ]
    },
    {
      "id": "G-06-native-required-native",
      "label": "native-required fields with native tag mode",
      "coverage": [
        "P1-no-dual-accept"
      ],
      "native_accepts": true,
      "bridge_accepts": false,
      "native_exit_code": 0,
      "bridge_exit_code": 1,
      "native_failure_head": [],
      "bridge_failure_head": [
        "unknown-top-level-field:canonical",
        "unknown-top-level-field:comparison",
        "unknown-top-level-field:differential_receipt",
        "unknown-top-level-field:graph",
        "unknown-top-level-field:input"
      ]
    },
    {
      "id": "G-07-native-required-bridge",
      "label": "native-required fields with bridge tag mode",
      "coverage": [
        "P1-no-dual-accept"
      ],
      "native_accepts": false,
      "bridge_accepts": false,
      "native_exit_code": 1,
      "bridge_exit_code": 1,
      "native_failure_head": [
        "non-canonical-artifact-json"
      ],
      "bridge_failure_head": [
        "non-canonical-artifact-json"
      ]
    },
    {
      "id": "G-08-native-required-both",
      "label": "native-required fields with both tag mode",
      "coverage": [
        "P1-no-dual-accept"
      ],
      "native_accepts": false,
      "bridge_accepts": false,
      "native_exit_code": 1,
      "bridge_exit_code": 1,
      "native_failure_head": [
        "non-canonical-artifact-json"
      ],
      "bridge_failure_head": [
        "non-canonical-artifact-json"
      ]
    },
    {
      "id": "G-09-native-required-wrong",
      "label": "native-required fields with wrong tag mode",
      "coverage": [
        "P1-no-dual-accept"
      ],
      "native_accepts": false,
      "bridge_accepts": false,
      "native_exit_code": 1,
      "bridge_exit_code": 1,
      "native_failure_head": [
        "non-canonical-artifact-json"
      ],
      "bridge_failure_head": [
        "non-canonical-artifact-json"
      ]
    },
    {
      "id": "G-10-native-required-none",
      "label": "native-required fields with none tag mode",
      "coverage": [
        "P1-no-dual-accept"
      ],
      "native_accepts": false,
      "bridge_accepts": false,
      "native_exit_code": 1,
      "bridge_exit_code": 1,
      "native_failure_head": [
        "tag-mismatch"
      ],
      "bridge_failure_head": [
        "non-canonical-artifact-json"
      ]
    },
    {
      "id": "G-11-bridge-plus-native-core-native",
      "label": "bridge-plus-native-core fields with native tag mode",
      "coverage": [
        "P1-no-dual-accept"
      ],
      "native_accepts": false,
      "bridge_accepts": false,
      "native_exit_code": 1,
      "bridge_exit_code": 1,
      "native_failure_head": [
        "non-canonical-artifact-json"
      ],
      "bridge_failure_head": [
        "non-canonical-artifact-json"
      ]
    },
    {
      "id": "G-12-bridge-plus-native-core-bridge",
      "label": "bridge-plus-native-core fields with bridge tag mode",
      "coverage": [
        "P1-no-dual-accept"
      ],
      "native_accepts": false,
      "bridge_accepts": false,
      "native_exit_code": 1,
      "bridge_exit_code": 1,
      "native_failure_head": [
        "unknown-top-level-field:bridge_report",
        "unknown-top-level-field:profile",
        "unknown-top-level-field:subject",
        "unknown-top-level-field:checks",
        "unknown-top-level-field:linked_artifacts"
      ],
      "bridge_failure_head": [
        "unknown-top-level-field:source",
        "unknown-top-level-field:input",
        "unknown-top-level-field:comparison"
      ]
    },
    {
      "id": "G-13-bridge-plus-native-core-both",
      "label": "bridge-plus-native-core fields with both tag mode",
      "coverage": [
        "P1-no-dual-accept"
      ],
      "native_accepts": false,
      "bridge_accepts": false,
      "native_exit_code": 1,
      "bridge_exit_code": 1,
      "native_failure_head": [
        "non-canonical-artifact-json"
      ],
      "bridge_failure_head": [
        "unknown-top-level-field:source",
        "unknown-top-level-field:input",
        "unknown-top-level-field:comparison",
        "unknown-top-level-field:differential_receipt"
      ]
    },
    {
      "id": "G-14-bridge-plus-native-core-wrong",
      "label": "bridge-plus-native-core fields with wrong tag mode",
      "coverage": [
        "P1-no-dual-accept"
      ],
      "native_accepts": false,
      "bridge_accepts": false,
      "native_exit_code": 1,
      "bridge_exit_code": 1,
      "native_failure_head": [
        "non-canonical-artifact-json"
      ],
      "bridge_failure_head": [
        "unknown-top-level-field:source",
        "unknown-top-level-field:input",
        "unknown-top-level-field:comparison",
        "unknown-top-level-field:differential_receipt",
        "tag-mismatch"
      ]
    },
    {
      "id": "G-15-bridge-plus-native-core-none",
      "label": "bridge-plus-native-core fields with none tag mode",
      "coverage": [
        "P1-no-dual-accept"
      ],
      "native_accepts": false,
      "bridge_accepts": false,
      "native_exit_code": 1,
      "bridge_exit_code": 1,
      "native_failure_head": [
        "non-canonical-artifact-json"
      ],
      "bridge_failure_head": [
        "unknown-top-level-field:source",
        "unknown-top-level-field:input",
        "unknown-top-level-field:comparison",
        "missing-bridge_report",
        "tag-mismatch"
      ]
    },
    {
      "id": "G-16-native-plus-bridge-core-native",
      "label": "native-plus-bridge-core fields with native tag mode",